{
  "$schema": "./webhook-v1.schema.json",
  "protocolVersion": "v1",
  "description": "Canonical, language-neutral conformance vectors for the QODIQA webhook signing protocol. Every expectedSignature was generated by calling the production signer directly — see \"generatedBy\" below and test-vectors/README.md for the full process and update procedure.",
  "generatedBy": {
    "generatorScript": "test-vectors/generate-webhook-vectors.js",
    "serverImplementation": "src/core/webhooks/webhookDelivery.js#computeSignature",
    "generatedAt": "2026-10-27T16:27:16.274Z"
  },
  "vectorCount": {
    "positive": 10,
    "negative": 12,
    "total": 22
  },
  "vectors": [
    {
      "id": "standard-json",
      "description": "A typical certification.completed event payload, standard JSON shape.",
      "protocolVersion": "v1",
      "tags": [
        "json"
      ],
      "scenario": {
        "secret": "whsec_conformance_standard_7f2a91",
        "timestamp": "2026-01-01T00:00:00.000Z",
        "body": "{\"eventId\":\"evt_conformance_001\",\"eventType\":\"certification.completed\",\"certificationId\":\"cert_9001\",\"tenantId\":\"tenant_042\",\"level\":\"L2\",\"score\":0.94,\"status\":\"PASS\"}",
        "expectedSignature": "sha256=eb7189f1b1050194cc07e3cfedfb934f1857993ff07f0edbcd796234673c32d4"
      },
      "verify": {
        "body": "{\"eventId\":\"evt_conformance_001\",\"eventType\":\"certification.completed\",\"certificationId\":\"cert_9001\",\"tenantId\":\"tenant_042\",\"level\":\"L2\",\"score\":0.94,\"status\":\"PASS\"}",
        "signature": "sha256=eb7189f1b1050194cc07e3cfedfb934f1857993ff07f0edbcd796234673c32d4",
        "timestamp": "2026-01-01T00:00:00.000Z",
        "secrets": [
          "whsec_conformance_standard_7f2a91"
        ],
        "verifyAt": "2026-01-01T00:00:00.000Z",
        "tolerance": 300
      },
      "expectedResult": "valid",
      "expectedError": null
    },
    {
      "id": "unicode-mixed-scripts",
      "description": "JSON payload with a message field mixing Japanese, Korean, Cyrillic, and Arabic scripts.",
      "protocolVersion": "v1",
      "tags": [
        "unicode"
      ],
      "scenario": {
        "secret": "whsec_conformance_unicode_a83c1d",
        "timestamp": "2026-01-01T00:00:01.000Z",
        "body": "{\"eventId\":\"evt_conformance_002\",\"eventType\":\"attestation.completed\",\"message\":\"こんにちは 안녕하세요 Привет مرحبا\"}",
        "expectedSignature": "sha256=c86cfc89f0d848414a55343766775cd6612a3e812e8f6598a9880d09a488e8cf"
      },
      "verify": {
        "body": "{\"eventId\":\"evt_conformance_002\",\"eventType\":\"attestation.completed\",\"message\":\"こんにちは 안녕하세요 Привет مرحبا\"}",
        "signature": "sha256=c86cfc89f0d848414a55343766775cd6612a3e812e8f6598a9880d09a488e8cf",
        "timestamp": "2026-01-01T00:00:01.000Z",
        "secrets": [
          "whsec_conformance_unicode_a83c1d"
        ],
        "verifyAt": "2026-01-01T00:00:01.000Z",
        "tolerance": 300
      },
      "expectedResult": "valid",
      "expectedError": null
    },
    {
      "id": "empty-payload",
      "description": "A zero-length body.",
      "protocolVersion": "v1",
      "tags": [
        "empty"
      ],
      "scenario": {
        "secret": "whsec_conformance_empty_5e6f2b",
        "timestamp": "2026-01-01T00:00:02.000Z",
        "body": "",
        "expectedSignature": "sha256=6e7ca64263018a603a69766f0d6149a23e5acc885c1e67fa408122684d5c4bd6"
      },
      "verify": {
        "body": "",
        "signature": "sha256=6e7ca64263018a603a69766f0d6149a23e5acc885c1e67fa408122684d5c4bd6",
        "timestamp": "2026-01-01T00:00:02.000Z",
        "secrets": [
          "whsec_conformance_empty_5e6f2b"
        ],
        "verifyAt": "2026-01-01T00:00:02.000Z",
        "tolerance": 300
      },
      "expectedResult": "valid",
      "expectedError": null
    },
    {
      "id": "plain-text-payload",
      "description": "A non-JSON, plain ASCII text body.",
      "protocolVersion": "v1",
      "tags": [
        "plain-text"
      ],
      "scenario": {
        "secret": "whsec_conformance_plaintext_c94b7e",
        "timestamp": "2026-01-01T00:00:03.000Z",
        "body": "This is a plain text webhook body, not JSON at all.",
        "expectedSignature": "sha256=49480c78fa9154ec0a4dafcd8b56e0721859ea6a7b0f3afa89ab371925fb1b3b"
      },
      "verify": {
        "body": "This is a plain text webhook body, not JSON at all.",
        "signature": "sha256=49480c78fa9154ec0a4dafcd8b56e0721859ea6a7b0f3afa89ab371925fb1b3b",
        "timestamp": "2026-01-01T00:00:03.000Z",
        "secrets": [
          "whsec_conformance_plaintext_c94b7e"
        ],
        "verifyAt": "2026-01-01T00:00:03.000Z",
        "tolerance": 300
      },
      "expectedResult": "valid",
      "expectedError": null
    },
    {
      "id": "long-payload",
      "description": "A large (~50 KB) JSON payload, to exercise HMAC over a non-trivial byte count.",
      "protocolVersion": "v1",
      "tags": [
        "long"
      ],
      "scenario": {
        "secret": "whsec_conformance_long_1b7d4a",
        "timestamp": "2026-01-01T00:00:04.000Z",